
cbeкак ceпродвинуть сайтcbe в cebcbeingce, Google
cbeкак ceпродвинуть сайтcbe в google.ceccbeomce, Google
cbeкак ceпродвинуть сайтcbe в cefcbeacebookce, Google
cbeкак ceпродвинуть сайтcbe в cegcbeooglece, Google
cbeкак ceпродвинуть сайт jcbeoomlace, Google
cbeкак ceпродвинуть сайтcbe в cemcbeail.ruce, Google
cbeкак ceпродвинуть сайтcbe в mail.cercbeuce, Google
cbeкак ceпродвинуть сайт scbeeoce, Google
продвинуть сайт ucbecozce, Google
cbeкак ceпродвинуть сайт wcbeordpressce, Google
cbeкак ceпродвинуть сайтcbe в ceycbeandexce, Google
cbeкак ceпродвинуть сайтcbe в топ ce1cbe00ce, Google
продвинуть сайт 2cbe013ce, Google
cbeкак ceпродвинуть сайтcbe в топ ce5, Google